{
  "schema_version": "1.0",
  "packet_id": "synthetic-demo-001",
  "intent": "Verify that the synthetic two-step demo shows its final state and preserves the ordered interaction.",
  "target": {
    "kind": "interaction",
    "locator": "http://127.0.0.1:8765/demo.html",
    "revision": "7a3419f514da56d5982d5f486ab1c1519653992a446f9226c5bf9ad66e136226",
    "base": "synthetic-demo-v1",
    "environment": "local-synthetic",
    "configuration_sha256": "0000000000000000000000000000000000000000000000000000000000000000"
  },
  "session": {
    "producer_id": "synthetic-producer",
    "verifier_id": "synthetic-verifier",
    "ephemeral": true,
    "inherited_context": false,
    "target_write_owned": false,
    "target_written": false,
    "started_at": "2026-09-07T00:41:58+00:00",
    "finished_at": "2026-09-07T00:44:35.223712+00:00",
    "attestation": "SIMULATED session admission for contract tests only. Media was captured by the implementation worker; this is not independent QA."
  },
  "freshness_seconds": 3600,
  "criteria": [
    {
      "id": "demo",
      "description": "Two clicks reach Step 2 of 2 in order, with current layout proof.",
      "required": true,
      "profile": "interaction",
      "visual": true,
      "sequence": true,
      "viewports": [
        {
          "width": 960,
          "height": 640
        }
      ]
    }
  ],
  "checks": [
    {
      "id": "two-clicks",
      "criterion_id": "demo",
      "status": "pass",
      "observation": "Observed Step 0, then Step 1, then Step 2 with an isolated synthetic page.",
      "artifact_ids": [
        "screen",
        "sequence"
      ],
      "owner": "demo producer",
      "action": "Correct only the failed step and request fresh verification."
    }
  ],
  "artifacts": [
    {
      "id": "screen",
      "path": "artifacts/current.png",
      "sha256": "5da2e72363a11fa6c49cc0afca48be2091b486b6875313f45a7b35775d0aa2ca",
      "size": 21176,
      "kind": "screenshot",
      "origin": "verifier",
      "session_id": "synthetic-verifier",
      "target_sha256": "f1495fe485c979eeb2bd85961d6af410a1ca7255e2963227e1384931783b7386",
      "captured_at": "2026-09-07T00:42:00.212083+00:00",
      "tool": {
        "name": "Playwright",
        "version": "1.58.0"
      },
      "sharing": "safe-to-share",
      "review": {
        "status": "approved",
        "reviewer": "fixture-author-reviewed-synthetic-media",
        "sha256": "5da2e72363a11fa6c49cc0afca48be2091b486b6875313f45a7b35775d0aa2ca"
      },
      "media": {
        "url": "http://127.0.0.1:8765/demo.html",
        "revision": "7a3419f514da56d5982d5f486ab1c1519653992a446f9226c5bf9ad66e136226",
        "viewport": {
          "width": 960,
          "height": 640
        },
        "sequence_proven": false
      }
    },
    {
      "id": "sequence",
      "path": "artifacts/interaction-trace.json",
      "sha256": "30b9137106575550ef58c3fc1935010944df06d2e07a79dd4a3fc115ce26f523",
      "size": 728,
      "kind": "trace",
      "origin": "verifier",
      "session_id": "synthetic-verifier",
      "target_sha256": "f1495fe485c979eeb2bd85961d6af410a1ca7255e2963227e1384931783b7386",
      "captured_at": "2026-09-07T00:42:00.212569+00:00",
      "tool": {
        "name": "Playwright",
        "version": "1.58.0"
      },
      "sharing": "safe-to-share",
      "review": {
        "status": "approved",
        "reviewer": "fixture-author-reviewed-synthetic-media",
        "sha256": "30b9137106575550ef58c3fc1935010944df06d2e07a79dd4a3fc115ce26f523"
      },
      "media": {
        "url": "http://127.0.0.1:8765/demo.html",
        "revision": "7a3419f514da56d5982d5f486ab1c1519653992a446f9226c5bf9ad66e136226",
        "viewport": {
          "width": 960,
          "height": 640
        },
        "sequence_proven": true
      }
    }
  ],
  "destinations": [
    {
      "id": "pr",
      "kind": "github-pr",
      "locator": "https://github.com/example/demo/pull/1",
      "authorized": false
    },
    {
      "id": "issue",
      "kind": "github-issue",
      "locator": "https://github.com/example/demo/issues/1",
      "authorized": false
    },
    {
      "id": "worker",
      "kind": "worker-thread",
      "locator": "synthetic-producer",
      "authorized": false
    }
  ],
  "risks": [
    "Synthetic contract example; does not certify the Final Boss process or model interpretation."
  ]
}
